{
  "name": "Your name",
  "bio": "Software engineer. Building useful things.",
  "description": "A simple home for projects, writing, and ways to get in touch.",
  "siteUrl": "",
  "placeholderLinks": true,
  "profile": {
    "initials": "YN",
    "image": "",
    "alt": "Profile portrait"
  },
  "primaryLink": {
    "label": "Explore my work",
    "url": "https://example.com/projects",
    "icon": "arrow",
    "id": "projects"
  },
  "secondaryLinks": [
    {
      "label": "Read my notes",
      "url": "https://example.com/notes",
      "icon": "none",
      "enabled": true,
      "id": "notes"
    },
    {
      "label": "Get in touch",
      "url": "https://example.com/contact",
      "icon": "none",
      "enabled": true,
      "id": "contact"
    }
  ],
  "previewNote": "Demo \u00b7 replace these example links with your own.",
  "seo": {
    "title": "Your name | Projects & links",
    "image": "",
    "imageAlt": ""
  },
  "analytics": {
    "cloudflareToken": "",
    "ga4MeasurementId": "",
    "ga4Consent": "required",
    "debug": false
  },
  "appearance": {
    "browserThemeColor": "#f8fafc",
    "colorScheme": "light",
    "faviconBackground": "#e1e9f8",
    "faviconText": "#314d7b"
  },
  "styles": {},
  "schemaVersion": 2,
  "browserOpening": {
    "mode": "native",
    "autoOpen": false,
    "showManual": true,
    "iosStrategy": "instagram",
    "androidPackage": "com.android.chrome",
    "fallbackDelayMs": 1800
  },
  "ageAcknowledgment": {
    "enabled": false,
    "remember": "session"
  }
}
